title,description,required_skills
Full Stack Developer,"We need a full stack developer for a 3-month project building a customer portal. Experience with modern web technologies required.","Python, Django, React, JavaScript"
Data Scientist,"Looking for a data scientist to analyze customer behavior patterns and create predictive models.","Python, Machine Learning, SQL, Statistics"
Mobile App Developer,"Develop a new iOS/Android app for our retail business.","Swift, Kotlin, Mobile Development"
Backend Engineer,"Build and maintain scalable API services for our platform.","Java, Spring Boot, PostgreSQL"
UX Designer,"Design user interfaces for our web application suite.","Figma, UI/UX, Wireframing, User Research"
